Symbol,Name,Last Sale,Net Change,% Change,Market Cap,Country,IPO Year,Volume,Sector,Industry
DECZ,TrueShares Structured Outcome (December) ETF,$26.313,0.2415,0.926%,,United States,2020,115,,
DEFN,Emles Trust Emles Protective Allocation ETF,$23.8437,-0.3858,-1.592%,,,2020,25243,,
DEH,D8 Holdings Corp. Class A Ordinary Shares,$10.25,-0.20,-1.914%,442031250.00,Hong Kong,2020,430998,Finance,Business Services
DEI,Douglas Emmett Inc. Common Stock,$33.64,0.16,0.478%,5902613939.00,United States,2006,3953292,Consumer Services,Real Estate Investment Trusts
DELL,Dell Technologies Inc. Class C Common Stock ,$79.68,-2.01,-2.461%,59744412839.00,,2018,2834242,Technology,Computer Manufacturing
DEN,Denbury Inc. Common Stock,$43.43,-0.19,-0.436%,2171499957.00,,2020,653838,Energy,Oil & Gas Production
DENN,Denny's Corporation Common Stock,$17.57,-0.67,-3.673%,1120405868.00,United States,,559348,Consumer Services,Restaurants
DEO,Diageo plc Common Stock,$161.53,-5.72,-3.42%,94483346182.00,United Kingdom,,371086,Consumer Non-Durables,Beverages (Production/Distribution)
DESP,Despegar.com Corp. Ordinary Shares,$12.18,-1.55,-11.289%,851942280.00,,2017,534131,Consumer Services,Transportation Services
DEX,Delaware Enhanced Global Dividend Common Shares of Beneficial Interest,$9.64,-0.06,-0.619%,114701530.00,United States,2007,43938,,
DFEB,FT Cboe Vest U.S. Equity Deep Buffer ETF - February,$32.52,-0.26,-0.793%,,United States,2020,73994,,
DFFN,Diffusion Pharmaceuticals Inc. Common Stock,$1.03,-0.13,-11.207%,100205454.00,United States,,10744138,Health Care,Major Pharmaceuticals
DFH,Dream Finders Homes Inc. Class A Common Stock,$23.91,-1.26,-5.006%,2212188635.00,United States,2021,182759,Capital Goods,Homebuilding
DFHT,Deerfield Healthcare Technology Acquisitions Corp. Class A Common Stock,$12.91,-0.35,-2.64%,231976563.00,United States,2020,55242,Health Care,Hospital/Nursing Management
DFHTU,Deerfield Healthcare Technology Acquisitions Corp. Unit,$13.50,-0.23,-1.675%,0.00,United States,2020,2317,Health Care,Hospital/Nursing Management
DFHTW,Deerfield Healthcare Technology Acquisitions Corp. Warrant,$2.99,-0.51,-14.571%,0.00,United States,2020,9728,Health Care,Hospital/Nursing Management
DFHY,TrimTabs Donoghue Forlines Tactical High Yield ETF,$25.1404,-0.1913,-0.755%,,,2020,5271,,
DFIN,Donnelley Financial Solutions Inc. Common Stock ,$23.95,1.24,5.46%,799340112.00,,2016,487252,Consumer Services,Other Consumer Services
DFNS,LGL Systems Acquisition Corp. Common Stock,$10.53,-0.30,-2.77%,227053125.00,United States,2020,77119,Finance,Business Services
DFNV,TrimTabs Donoghue Forlines Risk Managed Innovation ETF,$26.2302,-1.024,-3.757%,,,2020,4746,,
DFP,Flaherty & Crumrine Dynamic Preferred and Income Fund Inc. Common Stock,$28.55,-0.27,-0.937%,547353719.00,,2013,43433,,
DFPH,DFP Healthcare Acquisitions Corp. Class A Common Stock,$10.84,-0.39,-3.473%,311650000.00,United States,2020,7828,Finance,Business Services
DFPHU,DFP Healthcare Acquisitions Corp. Unit,$11.40,-0.09,-0.783%,0.00,United States,2020,1172,Finance,Business Services
DFPHW,DFP Healthcare Acquisitions Corp. Warrant,$2.70,0.48,21.622%,0.00,United States,2020,31832,Finance,Business Services
DFS,Discover Financial Services Common Stock,$95.00,-2.96,-3.022%,29135713590.00,United States,,2817489,Finance,Finance: Consumer Services
DG,Dollar General Corporation Common Stock,$188.68,-3.93,-2.04%,46226770378.00,United States,2009,3060771,Consumer Services,Department/Specialty Retail Stores
DGICA,Donegal Group Inc. Class A Common Stock,$14.02,-0.16,-1.128%,417402949.00,United States,,34516,Finance,Property-Casualty Insurers
DGICB,Donegal Group Inc. Class B Common Stock,$12.74,0.00,0.00%,379294834.00,United States,1986,23,Finance,Property-Casualty Insurers
DGII,Digi International Inc. Common Stock,$23.09,-0.66,-2.779%,685987876.00,United States,1989,132790,Technology,Computer Communications Equipment
DGLY,Digital Ally Inc. Common Stock,$1.99,-0.16,-7.442%,80537670.00,United States,,4254928,Technology,Radio And Television Broadcasting And Communications Equipment
DGNR,Dragoneer Growth Opportunities Corp. Class A Ordinary Shares,$11.11,-0.05,-0.448%,958237500.00,United States,2020,575737,Finance,Business Services
DGNS,Dragoneer Growth Opportunities Corp. II Class A Ordinary Shares,$11.77,-0.11,-0.926%,371696600.00,United States,2020,244087,Finance,Business Services
DGX,Quest Diagnostics Incorporated Common Stock,$114.63,-1.11,-0.959%,15297919253.00,United States,,1434426,Health Care,Medical Specialities
DHC,Diversified Healthcare Trust Common Shares of Beneficial Interest,$4.64,-0.18,-3.734%,1105565738.00,United States,,1744034,Consumer Services,Real Estate Investment Trusts
DHCNI,Diversified Healthcare Trust 5.625% Senior Notes due 2042,$20.70,-0.10,-0.481%,0.00,United States,,116730,Consumer Services,Real Estate Investment Trusts
DHCNL,Diversified Healthcare Trust 6.25% Senior Notes Due 2046,$22.10,-0.62,-2.729%,0.00,United States,,68415,Consumer Services,Real Estate Investment Trusts
DHF,BNY Mellon High Yield Strategies Fund Common Stock,$2.97,-0.11,-3.571%,215941833.00,United States,1998,4701867,,
DHHCU,DiamondHead Holdings Corp. Unit,$10.56,-0.115,-1.077%,0.00,United States,2021,283928,Finance,Business Services
DHI,D.R. Horton Inc. Common Stock,$74.53,-5.52,-6.896%,27106688595.00,United States,,6322372,Capital Goods,Homebuilding
DHIL,Diamond Hill Investment Group Inc. Class A Common Stock,$146.01,-3.98,-2.654%,461868469.00,United States,,6448,Finance,Investment Managers
DHR,Danaher Corporation Common Stock,$219.26,-3.74,-1.677%,155893860000.00,United States,,2923397,Capital Goods,Industrial Machinery/Components
DHR^A,Danaher Corporation 4.75% Mandatory Convertible Preferred Stock Series A,$1502.69,-41.565,-2.692%,,United States,,1721,,
DHR^B,Danaher Corporation 5.00% Mandatory Convertible Preferred Stock Series B,$1293.71,-16.95,-1.293%,,United States,,1099,,
DHT,DHT Holdings Inc.,$5.79,0.07,1.224%,988922319.00,Jersey,2005,2449933,Transportation,Marine Transportation
DHX,DHI Group Inc. Common Stock,$3.11,-0.05,-1.582%,162466901.00,United States,2007,137374,Miscellaneous,Business Services
DHY,Credit Suisse High Yield Bond Fund Common Stock,$2.32,-0.08,-3.333%,240137173.00,United States,1998,2126085,,
DIAX,Nuveen Dow 30SM Dynamic Overwrite Fund Common Shares of Beneficial Interest,$15.26,-0.19,-1.23%,554959092.00,,2014,255828,,
DIN,Dine Brands Global Inc. Common Stock,$77.52,-4.61,-5.613%,1272781422.00,United States,,292149,Consumer Services,Restaurants
DIOD,Diodes Incorporated Common Stock,$75.77,-5.80,-7.11%,3354807219.00,United States,,202176,Technology,Semiconductors
DIS,Walt Disney Company (The) Common Stock,$190.98,-6.53,-3.306%,346679099431.00,United States,,12685159,Consumer Services,Services-Misc. Amusement & Recreation
DISCA,Discovery Inc. Series A Common Stock,$51.32,-0.54,-1.041%,25009990887.00,United States,,9487906,Consumer Services,Television Services
DISCB,Discovery Inc. Series B Common Stock,$56.38,2.61,4.854%,27691167914.00,United States,,1557,Consumer Services,Television Services
DISCK,Discovery Inc. Series C Common Stock,$43.49,-0.04,-0.092%,21194164141.00,United States,,4779379,Consumer Services,Television Services
DISH,DISH Network Corporation Class A Common Stock,$31.55,0.15,0.478%,16600668233.00,United States,1995,6228307,Consumer Services,Television Services
DIT,AMCON Distributing Company Common Stock,$114.84,-1.61,-1.383%,63319216.00,United States,,246,Consumer Non-Durables,Food Distributors
DJAN,FT Cboe Vest U.S. Equity Deep Buffer ETF - January,$30.11,-0.34,-1.117%,,United States,2021,60509,,
DJCO,Daily Journal Corp. (S.C.) Common Stock,$345.00,-6.00,-1.709%,476357370.00,United States,,9612,Consumer Services,Newspapers/Magazines
DJUL,FT Cboe Vest U.S. Equity Deep Buffer ETF - July,$31.7801,-0.1954,-0.611%,,United States,2020,305,,
DJUN,FT Cboe Vest U.S. Equity Deep Buffer ETF - June,$32.5175,-0.1634,-0.50%,,United States,2020,686,,
DK,Delek US Holdings Inc. Common Stock,$25.45,-0.88,-3.342%,1876320541.00,United States,2017,963810,Energy,Integrated oil Companies
DKL,Delek Logistics Partners L.P. Common Units representing Limited Partner Interests,$37.77,-1.71,-4.331%,1640473437.00,United States,2012,259943,Energy,Natural Gas Distribution
DKNG,DraftKings Inc. Class A Common Stock,$57.81,-2.47,-4.098%,22644976281.00,United States,2019,14693105,Consumer Services,Services-Misc. Amusement & Recreation
DKS,Dick's Sporting Goods Inc Common Stock,$73.04,-2.04,-2.717%,6544287222.00,United States,2002,992764,Consumer Services,Other Specialty Stores
DL,China Distance Education Holdings Limited American Depositary Shares,$9.65,0.00,0.00%,326460542.00,China,,31789,Consumer Services,Other Consumer Services
DLA,Delta Apparel Inc. Common Stock,$27.14,0.29,1.08%,189292272.00,United States,,37709,Consumer Non-Durables,Apparel
DLB,Dolby Laboratories Common Stock,$96.75,-0.13,-0.134%,9831054170.00,United States,2005,446859,Miscellaneous,Multi-Sector Companies
DLCAU,Deep Lake Capital Acquisition Corp. Unit,$10.525,-0.035,-0.331%,0.00,United States,2021,131906,Finance,Business Services
DLHC,DLH Holdings Corp.,$10.47,0.09,0.867%,131334696.00,United States,,32232,Technology,Professional Services
DLNG,Dynagas LNG Partners LP Common Units,$2.91,-0.13,-4.276%,103632608.00,Greece,,73647,Consumer Services,Marine Transportation
DLNG^A,Dynagas LNG Partners LP 9.00% Series A Cumulative Redeemable Preferred Units,$24.50,0.02,0.082%,,Greece,,3763,,
DLNG^B,Dynagas LNG Partners LP 8.75% Series B Fixed to Floating Rate Cumulative Redeemable Perpetual Preferred Units liquidation preference $25.00 per Uni,$20.96,-0.09,-0.428%,,Greece,,7375,,
DLPN,Dolphin Entertainment Inc. Common Stock,$4.85,-0.24,-4.715%,31817659.00,United States,,86654,Consumer Services,Other Consumer Services
DLR,Digital Realty Trust Inc. Common Stock,$134.37,-0.78,-0.577%,37662530483.00,United States,2004,1386220,Consumer Services,Real Estate Investment Trusts
DLR^C,Digital Realty Trust Inc. 6.625% Series C Cumulative Redeemable Perpetual Preferred Stock,$25.4886,-0.0514,-0.201%,,United States,,25751,,
DLR^J,Digital Realty Trust Inc. 5.250% Series J Cumulative Redeemable Preferred Stock,$25.61,-0.22,-0.852%,,United States,,12022,,
DLR^K,Digital Realty Trust Inc. 5.850% Series K Cumulative Redeemable Preferred Stock par value $0.01 per share,$26.92,-0.32,-1.175%,,United States,,17142,,
DLR^L,Digital Realty Trust Inc. 5.200% Series L Cumulative Redeemable Preferred Stock,$26.06,-0.11,-0.42%,,United States,,31701,,
DLTH,Duluth Holdings Inc. Class B Common Stock,$13.82,-0.71,-4.886%,453685669.00,United States,2015,187019,Consumer Services,Clothing/Shoe/Accessory Stores
DLTR,Dollar Tree Inc. Common Stock,$98.88,-2.25,-2.225%,23255799990.00,United States,1995,3411840,Consumer Services,Department/Specialty Retail Stores
DLX,Deluxe Corporation Common Stock,$40.58,-0.93,-2.24%,1700058033.00,United States,,237491,Consumer Durables,Publishing
DLY,DoubleLine Yield Opportunities Fund Common Shares of Beneficial Interest,$18.94,-0.51,-2.622%,0.00,,2020,246568,,
DM,Desktop Metal Inc. Class A Common Stock,$20.66,-2.04,-8.987%,4787771601.00,,2019,4688494,Technology,Industrial Machinery/Components
DMAC,DiaMedica Therapeutics Inc. Common Stock,$9.25,-0.13,-1.386%,173336435.00,United States,2018,140427,Health Care,Major Pharmaceuticals
DMAY,FT Cboe Vest U.S. Equity Deep Buffer ETF - May,$32.8644,-0.1256,-0.381%,,United States,2020,4667,,
DMB,BNY Mellon Municipal Bond Infrastructure Fund Inc. Common Stock,$13.76,-0.22,-1.574%,253013004.00,,2013,60618,,
DMF,BNY Mellon Municipal Income Inc. Common Stock,$8.74,-0.03,-0.342%,181361975.00,United States,1988,78475,,
DMLP,Dorchester Minerals L.P. Common Units Representing Limited Partnership Interests,$14.77,-0.03,-0.203%,512220262.00,United States,,82487,Energy,Oil & Gas Production
DMO,Western Asset Mortgage Opportunity Fund Inc. Common Stock,$14.36,-0.23,-1.576%,157731360.00,United States,2010,43837,,
DMRC,Digimarc Corporation Common Stock,$34.76,-7.33,-17.415%,574020522.00,United States,,474699,Technology,EDP Services
DMS,Digital Media Solutions Inc. Class A Ordinary Shares,$13.88,-0.32,-2.254%,810481529.00,United States,2018,205601,Miscellaneous,Business Services
DMTK,DermTech Inc. Common Stock,$71.16,-4.57,-6.035%,1808885706.00,United States,2017,1116397,Health Care,Medical Specialities
DMYD,dMY Technology Group Inc. II Class A Common Stock,$18.20,-0.30,-1.622%,627900000.00,United States,2020,1355227,Finance,Business Services
DMYI,dMY Technology Group Inc. III Class A Common Stock,$13.12,-1.32,-9.141%,497330000.00,United States,2021,2054338,Finance,Business Services
DNB,Dun & Bradstreet Holdings Inc. Common Stock,$22.59,-0.11,-0.485%,9554490831.00,United States,2020,1365819,Finance,Finance: Consumer Services
DNK,Phoenix Tree Holdings Limited American Depositary Shares each representing ten (10) Class A ordinary shares,$2.31,-0.20,-7.968%,422452800.00,,2020,355755,Consumer Services,Building operators
DNLI,Denali Therapeutics Inc. Common Stock,$63.00,-3.76,-5.632%,7554865248.00,United States,2017,561017,Health Care,Biotechnology: Biological Products (No Diagnostic Substances)
DNMR,Danimer Scientific Inc. Common Stock,$38.91,-2.59,-6.241%,3335543019.00,,2020,2281073,Basic Industries,Major Chemicals
DNN,Denison Mines Corp Ordinary Shares (Canada),$1.09,-0.07,-6.034%,781826755.00,Canada,,41931678,Basic Industries,Precious Metals
DNOV,FT Cboe Vest U.S. Equity Deep Buffer ETF - November,$33.386,-0.3082,-0.915%,,United States,2019,10712,,
DNOW,NOW Inc. Common Stock,$10.96,-0.06,-0.544%,1198800712.00,,2014,861533,Energy,Metal Fabrications
DNP,DNP Select Income Fund Inc. Common Stock,$10.51,-0.09,-0.849%,3250769790.00,United States,1987,460952,,
DOC,Physicians Realty Trust Common Shares of Beneficial Interest,$17.46,-0.16,-0.908%,3635691470.00,United States,2013,2468793,Consumer Services,Real Estate Investment Trusts
DOCT,FT Cboe Vest U.S. Equity Deep Buffer ETF - October,$30.9621,-0.2629,-0.842%,,United States,2020,163,,
DOCU,DocuSign Inc. Common Stock,$225.73,-13.93,-5.812%,43172424100.00,United States,2018,4545777,Technology,Computer Software: Prepackaged Software
DOGZ,Dogness (International) Corporation Class A Common Stock,$2.18,-0.04,-1.802%,64023899.00,China,2017,3243684,Consumer Durables,Miscellaneous manufacturing industries
DOMO,Domo Inc. Class B Common Stock,$61.65,-6.29,-9.258%,1846372311.00,United States,2018,502144,Technology,Computer Software: Prepackaged Software
DOOO,BRP Inc. (Recreational Products) Common Subordinate Voting Shares,$69.76,-4.80,-6.438%,6133308269.00,Canada,,87284,Capital Goods,Industrial Specialties
DOOR,Masonite International Corporation Ordinary Shares (Canada),$110.75,-4.48,-3.888%,2713703595.00,Canada,,209596,Basic Industries,Forest Products
DORM,Dorman Products Inc. Common Stock,$99.52,-2.13,-2.095%,3213172085.00,United States,,125308,Capital Goods,Auto Parts:O.E.M.
DOV,Dover Corporation Common Stock,$124.28,-1.22,-0.972%,17852728417.00,United States,,1099039,Technology,Industrial Machinery/Components
DOW,Dow Inc. Common Stock ,$61.35,-2.34,-3.674%,45639158256.00,,2019,3258052,Basic Industries,Major Chemicals
DOX,Amdocs Limited Ordinary Shares,$76.67,-0.95,-1.224%,10030352750.00,Guernsey,,994403,Technology,EDP Services
DOYU,DouYu International Holdings Limited ADS,$14.95,-0.12,-0.796%,4798150923.00,China,2019,2995506,Technology,Computer Software: Programming Data Processing
DPG,Duff & Phelps Utility and Infrastructure Fund Inc.,$12.94,0.11,0.857%,490811690.00,United States,2011,205079,,
DPW,Ault Global Holdings Inc. Common Stock,$4.26,-0.36,-7.792%,118230174.00,United States,,10672332,Capital Goods,Industrial Machinery/Components
DPZ,Domino's Pizza Inc Common Stock,$339.00,-25.59,-7.019%,13356568134.00,United States,2004,2628148,Consumer Non-Durables,Food Distributors
DQ,DAQO New Energy Corp. American Depositary Shares each representing five ordinary shares,$97.90,-7.50,-7.116%,6802466957.00,China,2010,2948615,Technology,Semiconductors
DRD,DRDGOLD Limited American Depositary Shares,$9.25,-0.37,-3.846%,790980256.00,South Africa,,224634,Basic Industries,Precious Metals
DRE,Duke Realty Corporation Common Stock,$40.02,-0.33,-0.818%,14958109357.00,United States,,1768754,Consumer Services,Real Estate Investment Trusts
DRH,Diamondrock Hospitality Company Common Stock,$9.36,-0.86,-8.415%,1867496717.00,United States,2005,2432417,Consumer Services,Real Estate Investment Trusts
DRH^A,Diamondrock Hospitality Company 8.250% Series A Cumulative Redeemable Preferred Stock,$26.70,-0.10,-0.373%,,United States,,31653,,
DRI,Darden Restaurants Inc. Common Stock,$136.00,-2.78,-2.003%,17724630712.00,United States,,1078879,Consumer Services,Restaurants
DRIO,DarioHealth Corp. Common Stock,$26.97,-2.19,-7.51%,393708060.00,Israel,,197689,Health Care,Medical/Dental Instruments
DRIOW,DarioHealth Corp. Warrant,$0.1609,-0.0089,-5.241%,0.00,Israel,,60507,Health Care,Medical/Dental Instruments
DRNA,Dicerna Pharmaceuticals Inc. Common Stock,$28.31,0.29,1.035%,2124521006.00,United States,2014,1270972,Health Care,Major Pharmaceuticals
DRQ,Dril-Quip Inc. Common Stock,$37.05,0.20,0.543%,1300299205.00,United States,1997,210242,Energy,Metal Fabrications
DRRX,DURECT Corporation Common Stock,$2.265,-0.075,-3.205%,502452930.00,United States,2000,2483248,Health Care,Major Pharmaceuticals
DRTT,DIRTT Environmental Solutions Ltd. Common Shares,$2.40,-0.13,-5.138%,203235274.00,Canada,,545625,Technology,Computer Software: Prepackaged Software
DRUA,Dominion Energy Inc. 2016 Series A 5.25% Enhanced Junior Subordinated Notes due 2076,$25.30,-0.01,-0.04%,0.00,United States,2016,94420,Public Utilities,Electric Utilities: Central
DRVN,Driven Brands Holdings Inc. Common Stock,$29.17,-1.78,-5.751%,4883357080.00,United States,2021,1348915,Consumer Services,Automotive Aftermarket
DS,Drive Shack Inc.,$2.62,-0.09,-3.321%,239040757.00,United States,,2326055,Consumer Services,Restaurants
DS^B,Drive Shack Inc. Preferred Series B,$21.00,-0.335,-1.57%,,United States,,1300,,
DS^C,Drive Shack Inc. Preferred Series C,$20.12,0.00,0.00%,,United States,,61,,
DS^D,Drive Shack Inc. Pfd Ser D,$20.0001,0.00,0.00%,,United States,,50,,
DSAC,Duddell Street Acquisition Corp. Class A Ordinary Shares,$10.40,-0.10,-0.952%,227500000.00,Hong Kong,2020,130660,Finance,Business Services
DSACU,Duddell Street Acquisition Corp. Unit,$10.87,-0.73,-6.293%,0.00,Hong Kong,2020,1582,Finance,Business Services
DSACW,Duddell Street Acquisition Corp. Warrant,$2.3112,-0.1888,-7.552%,0.00,Hong Kong,2020,11583,Finance,Business Services
DSE,Duff & Phelps Select MLP and Midstream Energy Fund Inc.,$7.09,-0.09,-1.253%,18599587.00,United States,2014,20756,,
DSEP,FT Cboe Vest U.S. Equity Deep Buffer ETF - September,$31.1911,-0.2362,-0.752%,,United States,2020,797,,
DSGX,Descartes Systems Group Inc. (The) Common Stock,$58.12,-0.59,-1.005%,4910209208.00,Canada,,127597,Technology,Computer Software: Prepackaged Software
DSKE,Daseke Inc. Common Stock,$5.56,-0.18,-3.136%,361528847.00,United States,2015,217601,Consumer Services,Transportation Services
DSKEW,Daseke Inc. Warrant,$0.1997,0.0017,0.859%,0.00,United States,2015,65500,Consumer Services,Transportation Services
DSL,DoubleLine Income Solutions Fund Common Shares of Beneficial Interests,$17.33,-0.23,-1.31%,1766913216.00,,2013,421188,,
DSM,BNY Mellon Strategic Municipal Bond Fund Inc. Common Stock,$7.71,-0.03,-0.388%,381039850.00,United States,1989,108292,,
DSOC,Innovator Double Stacker ETF - October,$28.252,-0.5104,-1.775%,0.00,,2020,275,,
DSP,Viant Technology Inc. Class A Common Stock,$53.49,-2.08,-3.743%,3152463051.00,United States,2021,445818,Technology,Computer Software: Programming Data Processing
DSPG,DSP Group Inc. Common Stock,$15.31,-0.83,-5.143%,361271586.00,United States,1994,140116,Technology,Semiconductors
DSS,Document Security Systems Inc. Common Stock,$3.58,-0.24,-6.283%,99059048.00,United States,,3342273,Consumer Durables,Containers/Packaging
DSSI,Diamond S Shipping Inc. Common Stock ,$8.37,-0.04,-0.476%,338487763.00,,2019,292906,Consumer Services,Transportation Services
DSU,Blackrock Debt Strategies Fund Inc. Common Stock,$10.62,-0.10,-0.933%,496838051.00,United States,1998,88044,,
DSWL,Deswell Industries Inc. Common Shares,$3.6501,0.1001,2.82%,58092214.00,Macau,1995,31100,Consumer Non-Durables,Plastic Products
DSX,Diana Shipping inc. common stock,$3.06,0.13,4.437%,254821506.00,Greece,2005,973247,Transportation,Marine Transportation
DSX^B,Diana Shipping Inc. Perpetual Preferred Shares Series B (Marshall Islands),$25.5484,-0.0766,-0.299%,,Greece,,3709,,
DT,Dynatrace Inc. Common Stock,$50.06,-1.80,-3.471%,14146645778.00,United States,2019,9837872,Technology,Computer Software: Prepackaged Software
DTB,DTE Energy Company 2020 Series G 4.375% Junior Subordinated Debentures due 2080,$24.55,-0.12,-0.486%,0.00,United States,2020,81321,Public Utilities,Electric Utilities: Central
DTE,DTE Energy Company Common Stock,$121.24,-2.66,-2.147%,23493121812.00,United States,,676547,Public Utilities,Electric Utilities: Central
DTEA,DAVIDsTEA Inc. Common Stock,$3.80,-0.29,-7.09%,99677447.00,Canada,2015,411672,Consumer Non-Durables,Food Chains
DTF,DTF Tax-Free Income Inc. Common Stock,$14.11,-0.14,-0.982%,99187176.00,United States,1991,4456,,
DTIL,Precision BioSciences Inc. Common Stock,$11.13,-0.38,-3.301%,625980795.00,United States,2019,960465,Health Care,Biotechnology: Biological Products (No Diagnostic Substances)
DTJ,DTE Energy Company 2016 Series B 5.375% Junior Subordinated Debentures due 2076,$25.18,-0.02,-0.079%,0.00,United States,2016,57919,Public Utilities,Electric Utilities: Central
DTLA^,Brookfield DTLA Inc. 7.625% Series A Cumulative Redeemable Preferred Stock,$12.56,-0.52,-3.976%,,,,13534,,
DTP,DTE Energy Company 6.25% Corporate Units,$46.86,-0.61,-1.285%,0.00,United States,,42254,Public Utilities,Electric Utilities: Central
DTSS,Datasea Inc. Common Stock,$3.61,-0.08,-2.168%,77508310.00,China,,110038,Technology,Computer Software: Prepackaged Software
DTW,DTE Energy Company 2017 Series E 5.25% Junior Subordinated Debentures due 2077,$25.4921,-0.2178,-0.847%,0.00,United States,2017,38505,Public Utilities,Electric Utilities: Central
DTY,DTE Energy Company 2016 Series F 6.00% Junior Subordinated Debentures due 2076,$25.74,-0.43,-1.643%,0.00,United States,2016,22671,Public Utilities,Electric Utilities: Central
DUC,Duff & Phelps Utility & Corporate Bond Trust Inc. Common Stock,$10.43,-0.05,-0.477%,286769544.00,United States,1993,167739,,
DUDE,Merlyn.AI SectorSurfer Momentum ETF,$27.25,-1.39,-4.853%,,United States,2020,77145,,
DUK,Duke Energy Corporation (Holding Company) Common Stock,$87.12,-0.22,-0.252%,64116709747.00,United States,,3421648,Public Utilities,Power Generation
DUK^A,Duke Energy Corporation Depositary Shares each representing a 1/1000th interest in a share of 5.75% Series A Cumulative Redeemable Perpetual Preferred Stock,$26.61,-0.09,-0.337%,,United States,,116131,Public Utilities,Power Generation
DUKB,Duke Energy Corporation 5.625% Junior Subordinated Debentures due 2078,$26.38,-0.20,-0.752%,0.00,United States,2018,41158,Public Utilities,Power Generation
DUKH,Duke Energy Corporation 5.125% Junior Subordinated Debentures due 2073,$25.312,0.0406,0.161%,0.00,United States,,53164,Public Utilities,Power Generation
DUNE,Dune Acquisition Corporation Class A Common Stock,$10.01,-0.07,-0.694%,,United States,2021,201733,Finance,Business Services
DUNEU,Dune Acquisition Corporation Unit,$10.70,-0.14,-1.292%,0.00,United States,2020,143935,Finance,Business Services
DUNEW,Dune Acquisition Corporation Warrant,$1.38,-0.20,-12.658%,0.00,United States,2021,188233,Finance,Business Services
DUO,Fangdd Network Group Ltd. American Depositary Shares,$7.25,-0.64,-8.112%,578889039.00,China,2019,127269,Finance,Real Estate
DUOT,Duos Technologies Group Inc. Common Stock,$5.80,-0.32,-5.229%,20497287.00,United States,,38350,Technology,Computer Software: Prepackaged Software
DVA,DaVita Inc. Common Stock,$102.14,-0.75,-0.729%,11119981800.00,United States,,538398,Health Care,Misc Health and Biotechnology Services
DVAX,Dynavax Technologies Corporation Common Stock,$8.16,-1.22,-13.006%,899010529.00,United States,2004,4661790,Health Care,Major Pharmaceuticals
DVD,Dover Motorsports Inc. Common Stock,$2.31,-0.04,-1.702%,84020202.00,United States,1996,44128,Consumer Services,Services-Misc. Amusement & Recreation
DVN,Devon Energy Corporation Common Stock,$21.35,-0.92,-4.131%,14370685000.00,United States,,17191700,Energy,Oil & Gas Production
DWIN,Delwinds Insurance Acquisition Corp. Class A Common Stock,$10.08,-0.15,-1.466%,259950600.00,,2021,188959,Finance,Business Services
DWSN,Dawson Geophysical Company Common Stock,$3.00,-0.19,-5.956%,70434216.00,United States,,190005,Energy,Oil & Gas Production
DX,Dynex Capital Inc. Common Stock,$18.69,-0.30,-1.58%,502022184.00,United States,,391856,Consumer Services,Real Estate Investment Trusts
DX^C,Dynex Capital Inc. 6.900% Series C Fixed-to-Floating Rate Cumulative Redeemable Preferred Stock,$25.10,-0.09,-0.357%,,United States,,18897,,
DXC,DXC Technology Company Common Stock ,$24.89,-1.13,-4.343%,6336844486.00,,,2344209,Technology,EDP Services
DXCM,DexCom Inc. Common Stock,$395.47,-10.17,-2.507%,38035261746.00,United States,2005,624316,Health Care,Medical/Dental Instruments
DXF,Dunxin Financial Holdings Limited American Depositary Shares,$1.31,-0.15,-10.274%,27346078.00,China,,418163,Finance,Finance: Consumer Services
DXPE,DXP Enterprises Inc. Common Stock,$30.32,-1.63,-5.102%,539414539.00,United States,,62906,Capital Goods,Industrial Machinery/Components
DXR,Daxor Corporation Common Stock,$11.789,0.3039,2.646%,47317627.00,United States,,1085,Health Care,Medical/Dental Instruments
DXYN,Dixie Group Inc. (The) Common Stock,$5.32,-0.16,-2.92%,84128810.00,United States,,221985,Consumer Durables,Home Furnishings
