Symbol,Name,Last Sale,Net Change,% Change,Market Cap,Country,IPO Year,Volume,Sector,Industry
JCO,Nuveen Credit Opportunities 2022 Target Term Fund Common Shares of Beneficial Interest,$8.25,-0.04,-0.483%,228862697.00,United States,2017,22965,,
JCOM,j2 Global Inc. Common Stock,$109.57,-3.76,-3.318%,4904197939.00,United States,1999,278617,Technology,Telecommunications Equipment
JCS,Communications Systems Inc. Common Stock,$5.66,0.03,0.533%,52753889.00,United States,,13001,Public Utilities,Telecommunications Equipment
JCTCF,Jewett-Cameron Trading Company Common Shares,$10.5512,0.0012,0.011%,36814836.00,United States,,777,Consumer Services,RETAIL: Building Materials
JD,JD.com Inc. American Depositary Shares,$93.36,-3.01,-3.123%,144696516720.00,China,2014,11233162,Consumer Services,Other Specialty Stores
JDD,Nuveen Diversified Dividend and Income Fund Shares of Beneficial Interest,$9.06,-0.16,-1.735%,178812844.00,United States,2003,70246,,
JE,Just Energy Group Inc. Ordinary Shares (Canada),$3.46,-0.24,-6.486%,166257598.00,Canada,,3849926,Public Utilities,Oil/Gas Transmission
JEF,Jefferies Financial Group Inc. Common Stock,$29.25,-0.87,-2.888%,7312146602.00,United States,,1308672,Finance,Investment Bankers/Brokers/Service
JELD,JELD-WEN Holding Inc. Common Stock,$29.42,-1.57,-5.066%,2964114985.00,United States,2017,731860,Basic Industries,Forest Products
JEMD,Nuveen Emerging Markets Debt 2022 Target Term Fund Common Shares of Beneficial Interest $0.01 par value per share,$7.65,-0.11,-1.418%,108976262.00,,2017,16340,,
JEQ,Aberdeen Japan Equity Fund Inc.  Common Stock,$9.18,-0.14,-1.502%,123090360.00,United States,1992,16131,,
JFIN,Jiayin Group Inc. American Depositary Shares,$4.74,-0.43,-8.317%,256078500.00,China,2019,324629,Finance,Finance: Consumer Services
JFR,Nuveen Floating Rate Income Fund Common Stock,$9.25,-0.08,-0.857%,526495829.00,United States,2004,366883,,
JFU,9F Inc. American Depositary Shares,$2.18,-0.20,-8.403%,425516380.00,China,2019,8548448,Finance,Finance: Consumer Services
JG,Aurora Mobile Limited American Depositary Shares,$5.61,-0.43,-7.119%,649206181.00,China,2018,2005884,Technology,Computer Software: Programming Data Processing
JGH,Nuveen Global High Income Fund Common Shares of Beneficial Interest,$15.00,-0.21,-1.381%,347660895.00,United States,2014,55066,,
JHAA,Nuveen Corporate Income 2023 Target Term Fund,$9.92,0.00,0.00%,77618286.00,,2018,9715,,
JHB,Nuveen Corporate Income November 2021 Target Term Fund,$9.31,-0.03,-0.321%,520429456.00,,2016,94624,,
JHG,Janus Henderson Group plc Ordinary Shares,$29.68,-0.88,-2.88%,5115490939.00,,2017,1554904,Finance,Investment Managers
JHI,John Hancock Investors Trust Common Stock,$17.64,-0.20,-1.121%,153591921.00,United States,,21142,,
JHS,John Hancock Income Securities Trust Common Stock,$15.5476,-0.2624,-1.66%,181076429.00,United States,,11488,,
JHX,James Hardie Industries plc American Depositary Shares (Ireland),$29.55,-1.32,-4.276%,13125149300.00,Ireland,,27841,Capital Goods,Building Materials
JIH,Juniper Industrial Holdings Inc. Class A Common Stock,$13.39,-0.40,-2.901%,577443750.00,,2019,499471,Finance,Business Services
JILL,J. Jill Inc. Common Stock,$5.03,-0.29,-5.451%,48387846.00,,2017,658720,Consumer Non-Durables,Apparel
JJSF,J & J Snack Foods Corp. Common Stock,$158.97,2.63,1.682%,3017192894.00,United States,1986,119750,Consumer Non-Durables,Specialty Foods
JKHY,Jack Henry & Associates Inc. Common Stock,$151.32,-0.32,-0.211%,11512012345.00,United States,1985,677350,Technology,EDP Services
JKS,JinkoSolar Holding Company Limited American Depositary Shares (each representing 4 Common Shares),$49.94,-4.03,-7.467%,2261974819.00,China,2010,2043212,Technology,Semiconductors
JLL,Jones Lang LaSalle Incorporated Common Stock,$171.45,-2.93,-1.68%,8762941517.00,United States,,560321,Finance,Real Estate
JLS,Nuveen Mortgage and Income Fund,$20.24,-0.19,-0.93%,111065786.00,United States,2009,12509,,
JMIA,Jumia Technologies AG American Depositary Shares each representing two Ordinary Shares,$46.20,-5.78,-11.12%,4120884722.00,,2019,8458149,Consumer Services,Catalog/Specialty Distribution
JMM,Nuveen Multi-Market Income Fund (MA),$7.23,-0.03,-0.413%,68412791.00,United States,,8071,,
JMP,JMP Group LLC Common Shares,$5.35,-0.75,-12.295%,105876500.00,United States,2007,212955,Finance,Investment Bankers/Brokers/Service
JMPNL,JMP Group LLC 7.25% Senior Notes due 2027,$25.42,0.27,1.074%,0.00,United States,,484,Finance,Investment Bankers/Brokers/Service
JMPNZ,JMP Group LLC 6.875% Senior Notes due 2029,$24.37,-0.04,-0.164%,0.00,United States,,2995,Finance,Investment Bankers/Brokers/Service
JNCE,Jounce Therapeutics Inc. Common Stock,$11.76,0.75,6.812%,468653346.00,United States,2017,344141,Health Care,Biotechnology: Biological Products (No Diagnostic Substances)
JNJ,Johnson & Johnson Common Stock,$162.76,0.17,0.105%,427843928154.00,United States,,9709569,Health Care,Major Pharmaceuticals
JNPR,Juniper Networks Inc. Common Stock,$23.64,-0.11,-0.463%,7757988420.00,United States,1999,3246809,Technology,Computer Communications Equipment
JOB,GEE Group Inc. Common Stock,$1.79,-0.11,-5.789%,31624150.00,United States,,443042,Technology,Diversified Commercial Services
JOBS,51job Inc. American Depositary Shares,$66.43,0.54,0.82%,4477417673.00,China,2004,353025,Technology,Diversified Commercial Services
JOE,St. Joe Company (The) Common Stock,$52.96,1.37,2.656%,3118419795.00,United States,,810342,Consumer Services,Homebuilding
JOF,Japan Smaller Capitalization Fund Inc Common Stock,$9.06,-0.12,-1.307%,256705071.00,United States,1990,32476,,
JOFFU,JOFF Fintech Acquisition Corp. Unit,$10.50,-0.01,-0.095%,0.00,United States,2021,182623,Finance,Business Services
JOUT,Johnson Outdoors Inc. Class A Common Stock,$119.19,-7.92,-6.231%,1205269781.00,United States,,38640,Consumer Non-Durables,Recreational Products/Toys
JP,Jupai Holdings Limited American Depositary Shares each representing six ordinary shares,$2.70,-0.20,-6.897%,91028656.00,,2015,129089,Consumer Services,Other Consumer Services
JPC,Nuveen Preferred & Income Opportunities Fund,$9.05,-0.20,-2.162%,935364098.00,United States,2003,652187,,
JPI,Nuveen Preferred and Income Term Fund Common Shares of Beneficial Interest,$23.92,-0.08,-0.333%,544452473.00,,2012,98823,,
JPM,JP Morgan Chase & Co. Common Stock,$151.18,-2.08,-1.357%,461008292000.00,United States,,18106962,Finance,Major Banks
JPM^C,J P Morgan Chase & Co Depositary Shares each representing a 1/400th interest in a share of 6.00% Non-Cumulative  Preferred Stock Series EE,$26.95,-0.03,-0.111%,,United States,,292813,,
JPM^D,J P Morgan Chase & Co Depositary Shares each representing a 1/400th  interest in a share of 5.75% Non-Cumulative  Preferred Stock Series DD,$26.48,0.02,0.076%,,United States,,212501,,
JPM^G,J P Morgan Chase & Co Depositary Shares each representing a 1/400th interest in a share of 6.10% Non-Cumulative Preferred Stock Series AA,$25.55,0.03,0.118%,,United States,,87773,,
JPM^H,J P Morgan Chase & Co Depositary Shares each representing a 1/400th interest in a share of 6.15% Non-Cumulative Preferred Stock Series BB,$25.48,0.04,0.157%,,United States,,91307,Finance,Major Banks
JPM^J,J P Morgan Chase & Co Depositary Shares each representing a 1/400th interest in a share of JPMorgan Chase & Co. 4.75% Non-Cumulative Preferred Stock Series GG,$25.60,-0.18,-0.698%,,United States,,111852,Finance,Major Banks
JPS,Nuveen Preferred & Income Securities Fund,$9.21,-0.26,-2.746%,1876812584.00,United States,2002,788450,,
JPT,Nuveen Preferred and Income 2022 Term Fund Common Shares of Beneficial Interest,$23.985,-0.1227,-0.509%,164037732.00,United States,2017,13490,,
JQC,Nuveen Credit Strategies Income Fund Shares of Beneficial Interest,$6.37,-0.035,-0.546%,863831177.00,United States,2003,776453,,
JRI,Nuveen Real Asset Income and Growth Fund Common Shares of Beneficial Interest,$14.72,-0.06,-0.406%,404346330.00,United States,2012,179491,,
JRJC,China Finance Online Co. Limited American Depositary Shares,$12.49,-0.34,-2.65%,30500080.00,China,2004,48043,Finance,Investment Bankers/Brokers/Service
JRO,Nuveen Floating Rate Income Opportuntiy Fund Shares of Beneficial Interest,$9.16,-0.04,-0.435%,371357557.00,United States,2004,625728,,
JRS,Nuveen Real Estate Income Fund Common Shares of Beneficial Interest,$9.20,-0.14,-1.499%,265810733.00,United States,2001,97877,,
JRSH,Jerash Holdings (US) Inc. Common Stock,$5.84,-0.02,-0.341%,66138000.00,United States,2018,68122,Consumer Non-Durables,Apparel
JRVR,James River Group Holdings Ltd. Common Shares,$45.23,-1.57,-3.355%,1384497220.00,Bermuda,2014,296679,Finance,Property-Casualty Insurers
JSD,Nuveen Short Duration Credit Opportunities Fund Common Shares of Beneficial Interest,$13.65,-0.14,-1.015%,137669095.00,United States,2011,30583,,
JSM,Navient Corporation 6% Senior Notes due December 15 2043,$23.66,-0.45,-1.866%,0.00,United States,,16789,Finance,Finance: Consumer Services
JT,Jianpu Technology Inc. American depositary shares,$2.62,-0.23,-8.07%,55371570.00,,2017,212945,Technology,Computer Software: Programming Data Processing
JTA,Nuveen Tax-Advantaged Total Return Strategy Fund Common Share of Beneficial Interest,$10.07,-0.17,-1.66%,139478533.00,United States,2004,72686,,
JTD,Nuveen Tax-Advantaged Dividend Growth Fund Common Shares of Beneficial Interest,$14.30,-0.18,-1.243%,207126062.00,United States,,74391,,
JUPW,Jupiter Wellness Inc. Common Stock,$5.66,-0.16,-2.749%,51972005.00,United States,2020,305366,Consumer Non-Durables,Package Goods/Cosmetics
JUPWW,Jupiter Wellness Inc. Warrant,$1.00,-0.07,-6.542%,0.00,United States,2020,14271,Consumer Non-Durables,Package Goods/Cosmetics
JVA,Coffee Holding Co. Inc. Common Stock,$5.48,-0.85,-13.428%,31283123.00,United States,2005,220853,Consumer Non-Durables,Packaged Foods
JW/A,John Wiley & Sons Inc.,$53.33,-2.00,-3.615%,,United States,,285779,,
JW/B,John Wiley & Sons Inc.,$54.04,0.00,0.00%,,United States,,27,,
JWN,Nordstrom Inc. Common Stock,$36.97,-0.42,-1.123%,5829559660.00,United States,,3592350,Consumer Services,Clothing/Shoe/Accessory Stores
JWS,Jaws Acquisition Corp. Class A Ordinary Shares,$14.27,-1.19,-7.697%,1230787500.00,,2020,1573478,Health Care,Medical/Nursing Services
JYAC,Jiya Acquisition Corp. Class A Common Stock,$10.67,-0.355,-3.22%,146467517.00,United States,2020,20937,Finance,Business Services
JYNT,The Joint Corp. Common Stock,$38.38,-0.61,-1.565%,538899183.00,United States,2014,141629,Miscellaneous,Multi-Sector Companies
K,Kellogg Company Common Stock,$58.74,0.13,0.222%,20203641268.00,United States,,3423565,Consumer Non-Durables,Packaged Foods
KAI,Kadant Inc Common Stock,$166.91,-0.15,-0.09%,1921060660.00,United States,,28879,Technology,Industrial Machinery/Components
KAIIU,Kismet Acquisition Two Corp. Unit,$10.15,-0.04,-0.393%,0.00,United States,2021,226177,Finance,Business Services
KAIRU,Kairos Acquisition Corp. Unit,$10.57,-0.04,-0.377%,0.00,United States,2021,127434,Finance,Business Services
KALA,Kala Pharmaceuticals Inc. Common Stock,$7.735,-1.195,-13.382%,433623056.00,United States,2017,4992997,Health Care,Major Pharmaceuticals
KALU,Kaiser Aluminum Corporation Common Stock,$117.07,-4.43,-3.646%,1851130625.00,United States,,164992,Capital Goods,Metal Fabrications
KALV,KalVista Pharmaceuticals Inc. Common Stock,$33.22,-1.43,-4.127%,774596255.00,United Kingdom,2015,335285,Health Care,Major Pharmaceuticals
KAMN,Kaman Corporation Common Stock,$55.88,-2.02,-3.489%,1546612721.00,United States,,158073,Capital Goods,Military/Government/Technical
KAR,KAR Auction Services Inc Common Stock,$14.25,-0.78,-5.19%,1848253557.00,United States,2009,2490758,Consumer Durables,Automotive Aftermarket
KB,KB Financial Group Inc,$39.49,0.20,0.509%,15584109889.00,South Korea,,222646,Finance,Commercial Banks
KBAL,Kimball International Inc. Class B Common Stock,$12.79,-0.13,-1.006%,471719654.00,United States,,432071,Consumer Durables,Home Furnishings
KBH,KB Home Common Stock,$39.27,-2.34,-5.624%,3878387196.00,United States,1986,1483230,Capital Goods,Homebuilding
KBNT,Kubient Inc. Common Stock,$7.94,-0.53,-6.257%,93343505.00,United States,2020,1372737,Technology,EDP Services
KBNTW,Kubient Inc. Warrant,$4.00,-0.45,-10.112%,0.00,United States,2020,35947,Technology,EDP Services
KBR,KBR Inc. Common Stock,$32.07,-0.45,-1.384%,4570842590.00,United States,2006,1057605,Basic Industries,Military/Government/Technical
KBSF,KBS Fashion Group Limited Common Stock,$3.93,-0.40,-9.238%,10183805.00,China,2013,80221,Consumer Non-Durables,Apparel
KC,Kingsoft Cloud Holdings Limited American Depositary Shares,$57.46,-3.12,-5.15%,12527300834.00,China,2020,994067,Technology,Computer Software: Prepackaged Software
KCAPL,KCAP Financial Inc. 6.125% Notes due 2022,$25.41,-0.004,-0.016%,0.00,United States,,767,,
KDMN,Kadmon Holdings Inc. Common Stock,$4.60,-0.255,-5.252%,788959547.00,United States,,1940049,Health Care,Major Pharmaceuticals
KDNY,Chinook Therapeutics Inc. Common Stock,$16.26,-0.23,-1.395%,685496104.00,United States,2015,126347,Health Care,Major Pharmaceuticals
KDP,Keurig Dr Pepper Inc. Common Stock,$30.86,-0.60,-1.907%,43427836653.00,United States,,5883284,Consumer Non-Durables,Beverages (Production/Distribution)
KE,Kimball Electronics Inc. Common Stock,$23.96,-0.93,-3.736%,597971182.00,United States,,119057,Technology,Electrical Products
KELYA,Kelly Services Inc. Class A Common Stock,$21.29,-0.61,-2.785%,836628020.00,United States,,229116,Technology,Professional Services
KELYB,Kelly Services Inc. Class B Common Stock,$21.35,-0.23,-1.066%,838985826.00,United States,,1024,Technology,Professional Services
KEN,Kenon Holdings Ltd. Ordinary Shares,$29.085,0.035,0.12%,1566842660.00,Singapore,2015,1188,Public Utilities,Electric Utilities: Central
KEP,Korea Electric Power Corporation Common Stock,$10.34,-0.18,-1.711%,13275817112.00,South Korea,1994,237295,Public Utilities,Electric Utilities: Central
KEQU,Kewaunee Scientific Corporation Common Stock,$12.40,-0.0743,-0.596%,34258683.00,United States,,2147,Capital Goods,Medical Specialities
KERN,Akerna Corp. Common Stock,$5.87,-0.65,-9.969%,82524610.00,United States,2018,1245262,Technology,EDP Services
KERNW,Akerna Corp Warrant,$1.90,-0.10,-5.00%,0.00,United States,2018,45619,Technology,EDP Services
KEX,Kirby Corporation Common Stock,$63.57,-1.90,-2.902%,3816679230.00,United States,,406976,Consumer Services,Marine Transportation
KEY,KeyCorp Common Stock,$20.68,-0.86,-3.993%,20035097343.00,United States,,9251615,Finance,Major Banks
KEY^I,KeyCorp Depositary Shares Each Representing a 1/40th Ownership Interest in a Share of Fixed-to-Floating Rate Perpetual Non-Cumulative Preferred Stock Series E,$27.91,-0.38,-1.343%,,United States,,71398,,
KEY^J,KeyCorp Depositary Shares each representing a 1/40th ownership interest in a share of Fixed Rate Perpetual Non-Cumulative Preferred Stock Series F,$26.14,-0.12,-0.457%,,United States,,29370,,
KEY^K,KeyCorp Depositary Shares each representing a 1/40th ownership interest in a share of Fixed Rate Perpetual Non-Cumulative Preferred Stock Series G,$26.40,-0.35,-1.308%,,United States,,32507,,
KEYS,Keysight Technologies Inc. Common Stock,$139.63,-4.01,-2.792%,25982982226.00,United States,2014,1303176,Capital Goods,Industrial Machinery/Components
KF,Korea Fund Inc. (The) New Common Stock,$43.39,0.3974,0.924%,218304592.00,United States,,7367,,
KFFB,Kentucky First Federal Bancorp Common Stock,$7.29,0.26,3.698%,60100327.00,United States,,3095,Finance,Savings Institutions
KFRC,Kforce Inc. Common Stock,$51.89,0.26,0.504%,1139300887.00,United States,1995,130157,Technology,Professional Services
KFS,Kingsway Financial Services Inc. Common Stock (DE),$4.545,-0.095,-2.047%,103221809.00,Canada,,8548,Finance,Property-Casualty Insurers
KFY,Korn Ferry Common Stock,$62.00,-1.97,-3.08%,3344150544.00,United States,1999,431380,Technology,Diversified Commercial Services
KGC,Kinross Gold Corporation Common Stock,$6.58,-0.23,-3.377%,8280272000.00,Canada,,17846210,Basic Industries,Precious Metals
KHC,The Kraft Heinz Company Common Stock,$37.27,-0.33,-0.878%,45587760091.00,United States,,10442029,Consumer Non-Durables,Packaged Foods
KIDS,OrthoPediatrics Corp. Common Stock,$54.62,-1.18,-2.115%,1068073399.00,United States,2017,387835,Health Care,Medical/Dental Instruments
KIIIU,Kismet Acquisition Three Corp. Unit,$10.17,0.01,0.098%,0.00,United States,2021,502579,Finance,Business Services
KIM,Kimco Realty Corporation Common Stock,$18.62,-0.53,-2.768%,8053498995.00,United States,,5543012,Consumer Services,Real Estate Investment Trusts
KIM^L,Kimco Realty Corporation Class L Depositary Shares each of which represents a one-one thousandth fractional interest in a share of 5.125% Class L Cumulative Redeemable Preferred Stock liquidation preference $25000.00 per share,$25.3802,-0.1898,-0.742%,,United States,,23319,,
KIM^M,Kimco Realty Corporation Class M Depositary Shares each of which represents a one-one thousandth fractional interest in a share of 5.25% Class M Cumulative Redeemable Preferred Stock liquidation preference $25000.00 per share,$25.86,-0.07,-0.27%,,United States,,26665,,
KIN,Kindred Biosciences Inc. Common Stock,$4.59,-0.14,-2.96%,181268895.00,United States,2013,379169,Health Care,Major Pharmaceuticals
KINS,Kingstone Companies Inc. Common Stock,$7.08,-0.31,-4.195%,75580402.00,United States,,13324,Finance,Property-Casualty Insurers
KINZ,KINS Technology Group Inc. Class A Common Stock,$10.23,0.01,0.098%,352935000.00,United States,2021,223710,Finance,Business Services
KINZU,KINS Technology Group Inc. Unit,$10.85,-0.14,-1.274%,0.00,United States,2020,155997,Finance,Business Services
KINZW,KINS Technology Group Inc. Warrant,$1.37,-0.14,-9.272%,0.00,United States,2021,129337,Finance,Business Services
KIO,KKR Income Opportunities Fund Common Shares,$15.16,-0.14,-0.915%,308359175.00,,2013,112472,,
KIQ,Kelso Technologies Inc Ordinary Shares,$1.06,-0.10,-8.621%,50000291.00,Canada,,3306964,Capital Goods,Railroads
KIRK,Kirkland's Inc. COMMONSTOCK,$25.12,-2.06,-7.579%,358100572.00,United States,2002,864038,Consumer Services,Other Specialty Stores
KJUL,Innovator Russell 2000 Power Buffer ETF - July,$26.245,-0.0663,-0.252%,,,2020,8617,,
KKR,KKR & Co. Inc. Common Stock,$44.96,-0.48,-1.056%,25924438383.00,United States,,4421308,Finance,Investment Managers
KKR^A,KKR & Co. Inc. 6.75% Series A Preferred Stock,$25.73,0.00,0.00%,,United States,,26335,,
KKR^B,KKR & Co. Inc. 6.50% Series B Preferred Stock,$25.75,-0.03,-0.116%,,United States,,19497,,
KKR^C,KKR & Co. Inc. 6.00% Series C Mandatory Convertible Preferred Stock,$63.31,-0.72,-1.124%,,United States,,12018,,
KL,Kirkland Lake Gold Ltd. Common Shares,$34.56,-1.15,-3.22%,9228341733.00,,,2344983,Basic Industries,Precious Metals
KLAC,KLA Corporation Common Stock,$304.79,-23.64,-7.198%,46960412878.00,United States,1980,1528003,Capital Goods,Electronic Components
KLAQU,KL Acquisition Corp Unit,$10.31,-0.06,-0.579%,0.00,United States,2021,167581,Finance,Business Services
KLDO,Kaleido Biosciences Inc. Common Stock,$9.59,-0.25,-2.541%,401182373.00,United States,2019,160059,Health Care,Biotechnology: Biological Products (No Diagnostic Substances)
KLIC,Kulicke and Soffa Industries Inc. Common Stock,$47.50,-2.59,-5.171%,2948656883.00,Singapore,,1276594,Technology,Semiconductors
KLR,Kaleyra Inc. Common Stock,$17.79,-0.71,-3.838%,538835742.00,United States,2018,1256207,Technology,EDP Services
KLXE,KLX Energy Services Holdings Inc. Common Stock,$15.93,-0.03,-0.188%,135566180.00,United States,,155052,Energy,Oilfield Services/Equipment
KMB,Kimberly-Clark Corporation Common Stock,$130.56,-0.25,-0.191%,44176793917.00,United States,,1611241,Consumer Durables,Containers/Packaging
KMDA,Kamada Ltd. Ordinary Shares,$6.26,-0.23,-3.544%,280090948.00,Israel,2013,198248,Health Care,Major Pharmaceuticals
KMF,Kayne Anderson NextGen Energy & Infrastructure Inc.,$6.28,-0.25,-3.828%,296400061.00,,2010,267574,,
KMI,Kinder Morgan Inc. Common Stock,$15.29,-0.43,-2.735%,34623443864.00,United States,2011,17380613,Public Utilities,Natural Gas Distribution
KMPH,KemPharm Inc. Common Stock,$8.71,-0.81,-8.508%,164183352.00,United States,,2533791,Health Care,Major Pharmaceuticals
KMPR,Kemper Corporation,$75.55,-2.31,-2.967%,4945101452.00,United States,,230973,Finance,Property-Casualty Insurers
KMT,Kennametal Inc. Common Stock,$38.29,-1.43,-3.60%,3198478685.00,United States,,696647,Capital Goods,Industrial Machinery/Components
KMX,CarMax Inc,$118.92,-2.92,-2.397%,19329429353.00,United States,,982517,Consumer Durables,Automotive Aftermarket
KN,Knowles Corporation Common Stock,$20.80,-0.88,-4.059%,1907908600.00,,2014,531950,Consumer Non-Durables,Consumer Electronics/Appliances
KNDI,Kandi Technologies Group Inc Common Stock,$7.13,-0.42,-5.563%,516051967.00,China,,4261876,Capital Goods,Auto Manufacturing
KNGS,UPHOLDINGS Compound Kings ETF,$27.4371,-0.5615,-2.005%,,United States,2020,3270,,
KNL,Knoll Inc. Common Stock,$16.59,-0.78,-4.491%,840815259.00,United States,2004,337886,Consumer Durables,Office Equipment/Supplies/Services
KNOP,KNOT Offshore Partners LP Common Units representing Limited Partner Interests,$16.80,-0.09,-0.533%,549260779.00,United Kingdom,2013,218292,Consumer Services,Marine Transportation
KNSA,Kiniksa Pharmaceuticals Ltd. Class A Common Stock,$20.82,-1.05,-4.801%,1417322229.00,United States,2018,304151,Health Care,Major Pharmaceuticals
KNSL,Kinsale Capital Group Inc. Common Stock,$168.53,-7.17,-4.081%,3821768798.00,United States,2016,136373,Finance,Property-Casualty Insurers
KNTE,Kinnate Biopharma Inc. Common Stock,$33.74,-0.42,-1.23%,1461860369.00,United States,2020,102257,Health Care,Major Pharmaceuticals
KNX,Knight-Swift Transportation Holdings Inc.,$43.09,-0.54,-1.238%,7318040929.00,United States,2017,1130902,Transportation,Trucking Freight/Courier Services
KO,Coca-Cola Company (The) Common Stock,$50.17,-0.54,-1.065%,215831340000.00,United States,,14198315,Consumer Non-Durables,Beverages (Production/Distribution)
KOD,Kodiak Sciences Inc Common Stock,$121.08,-8.87,-6.826%,6147918003.00,United States,2018,247528,Health Care,Biotechnology: Biological Products (No Diagnostic Substances)
KODK,Eastman Kodak Company Common New,$8.82,-0.27,-2.97%,680580535.00,United States,,5085466,Miscellaneous,Industrial Machinery/Components
KOF,Coca Cola Femsa S.A.B. de C.V.  American Depositary Shares each representing 10 Units (each Unit consists of 3 Series B Shares and 5 Series L Shares),$42.51,-1.67,-3.78%,8930637937.00,Mexico,1993,256198,Consumer Non-Durables,Beverages (Production/Distribution)
KOP,Koppers Holdings Inc. Koppers Holdings Inc. Common Stock,$34.61,-1.14,-3.189%,729074082.00,United States,2006,165945,Basic Industries,Forest Products
KOPN,Kopin Corporation Common Stock,$8.71,-1.57,-15.272%,740811978.00,United States,1992,6478439,Technology,Semiconductors
KOR,Corvus Gold Inc. Common Shares,$2.00,-0.07,-3.382%,253265690.00,Canada,,320472,Basic Industries,Precious Metals
KOS,Kosmos Energy Ltd. Common Shares (DE),$3.40,0.05,1.493%,1386667978.00,Bermuda,2011,11925954,Energy,Oil & Gas Production
KOSS,Koss Corporation Common Stock,$21.53,3.09,16.757%,180752381.00,United States,,38196083,Consumer Non-Durables,Consumer Electronics/Appliances
KPTI,Karyopharm Therapeutics Inc. Common Stock,$14.56,-0.24,-1.622%,1076318880.00,United States,2013,1543428,Health Care,Major Pharmaceuticals
KR,Kroger Company (The) Common Stock,$32.41,-0.34,-1.038%,24675258215.00,United States,,8037833,Consumer Services,Food Chains
KRA,Kraton Corporation Common Stock,$38.25,-6.24,-14.026%,1219099984.00,United States,2009,472199,Basic Industries,Major Chemicals
KRBP,Kiromic BioPharma Inc. Common Stock,$10.91,-0.11,-0.998%,80003019.00,United States,2020,13663,Health Care,Biotechnology: Biological Products (No Diagnostic Substances)
KRC,Kilroy Realty Corporation Common Stock,$64.70,-0.94,-1.432%,7529080511.00,United States,1997,3112736,Consumer Services,Real Estate Investment Trusts
KREF,KKR Real Estate Finance Trust Inc. Common Stock,$18.41,-0.53,-2.798%,1023953669.00,United States,2017,598356,Consumer Services,Real Estate Investment Trusts
KRG,Kite Realty Group Trust Common Stock,$19.29,-0.12,-0.618%,1623986501.00,United States,2004,628114,Consumer Services,Real Estate Investment Trusts
KRKR,36Kr Holdings Inc. American Depositary Shares,$4.52,-0.35,-7.187%,169474417.00,China,2019,633060,Miscellaneous,Business Services
KRMD,Repro Med Systems Inc. Common Stock,$4.02,-0.13,-3.133%,176650410.00,United States,,438601,Health Care,Medical/Dental Instruments
KRNLU,Kernel Group Holdings Inc. Units,$10.29,-0.11,-1.058%,0.00,United States,2021,46893,Finance,Business Services
KRNT,Kornit Digital Ltd. Ordinary Shares,$110.87,-4.13,-3.591%,5019963877.00,Israel,2015,308336,Capital Goods,Industrial Machinery/Components
KRNY,Kearny Financial Corp Common Stock,$11.49,-0.11,-0.948%,967460999.00,United States,,321725,Finance,Savings Institutions
KRO,Kronos Worldwide Inc Common Stock,$14.63,-0.32,-2.14%,1690389950.00,United States,,152996,Basic Industries,Major Chemicals
KRON,Kronos Bio Inc. Common Stock,$29.15,-0.08,-0.274%,1633376642.00,United States,2020,60341,Health Care,Major Pharmaceuticals
KROS,Keros Therapeutics Inc. Common Stock,$64.70,-1.88,-2.824%,1499639310.00,United States,2020,94257,Health Care,Major Pharmaceuticals
KRP,Kimbell Royalty Partners Common Units Representing Limited Partner Interests,$10.35,0.14,1.371%,621850335.00,United States,2017,319414,Energy,Oil & Gas Production
KRTX,Karuna Therapeutics Inc. Common Stock,$120.81,-12.27,-9.22%,3238501238.00,United States,2019,515087,Health Care,Major Pharmaceuticals
KRUS,Kura Sushi USA Inc. Class A Common Stock,$29.55,-0.42,-1.401%,247383321.00,United States,2019,102058,Consumer Services,Restaurants
