Symbol,Name,Last Sale,Net Change,% Change,Market Cap,Country,IPO Year,Volume,Sector,Industry
PRPO,Precipio Inc.  Common Stock,$2.58,-0.14,-5.147%,44445443.00,United States,,223155,Capital Goods,Biotechnology: Laboratory Analytical Instruments
PRQR,ProQR Therapeutics N.V. Ordinary Shares,$4.55,-0.205,-4.311%,228165228.00,Netherlands,2014,644391,Health Care,Major Pharmaceuticals
PRS,Prudential Financial Inc. 5.625% Junior Subordinated Notes due 2058,$26.13,-0.25,-0.948%,890028746.00,United States,2018,54830,Finance,Life Insurance
PRSP,Perspecta Inc. Common Stock ,$29.14,-0.07,-0.24%,4693606230.00,,1998,2627840,Technology,EDP Services
PRSRU,Prospector Capital Corp. Unit,$10.65,-0.40,-3.62%,0.00,United States,2021,261333,Finance,Business Services
PRT,PermRock Royalty Trust Trust Units,$5.06,0.07,1.403%,61558604.00,United States,2018,132893,Energy,Oil & Gas Production
PRTA,Prothena Corporation plc Ordinary Shares,$22.60,-0.35,-1.525%,902223934.00,United States,,286872,Health Care,Major Pharmaceuticals
PRTC,PureTech Health plc American Depositary Shares,$54.735,-4.715,-7.931%,1564866753.00,United Kingdom,,247,Health Care,Major Pharmaceuticals
PRTG,Portage Biotech Inc. Common Stock,$36.60,36.60,,,Canada,,6457,,
PRTH,Priority Technology Holdings Inc. Common Stock,$8.53,-0.69,-7.484%,573382582.00,United States,2016,59885,Miscellaneous,Business Services
PRTK,Paratek Pharmaceuticals Inc. Common Stock,$7.34,-0.33,-4.302%,335006452.00,United States,,819341,Health Care,Major Pharmaceuticals
PRTS,CarParts.com Inc. Common Stock,$17.30,-0.54,-3.027%,818645792.00,United States,2007,1494224,Consumer Services,Other Specialty Stores
PRTY,Party City Holdco Inc. Common Stock,$7.48,-0.69,-8.446%,827633202.00,United States,2015,2039466,Consumer Services,Other Specialty Stores
PRU,Prudential Financial Inc. Common Stock,$87.91,-2.00,-2.224%,34900270000.00,United States,2001,3202337,Finance,Life Insurance
PRVB,Provention Bio Inc. Common Stock,$12.83,-1.82,-12.423%,804927142.00,United States,2018,1506169,Health Care,Major Pharmaceuticals
PS,Pluralsight Inc. Class A Common Stock,$20.70,-0.30,-1.429%,3091789902.00,United States,2018,1792616,Technology,Computer Software: Programming Data Processing
PSA,Public Storage Common Stock,$243.36,0.75,0.309%,42544716477.00,United States,,816453,Consumer Services,Real Estate Investment Trusts
PSA^C,Public Storage Depositary Shares Each Representing 1/1000 of a 5.125% Cumulative Preferred Share of Beneficial Interest Series C,$25.34,-0.01,-0.039%,,United States,,10959,Consumer Services,Real Estate Investment Trusts
PSA^D,Public Storage Depositary Shares Each Representing 1/1000 of a 4.95% Cumulative Preferred Share of Beneficial Interest Series D,$25.50,0.15,0.592%,,United States,,159963,Consumer Services,Real Estate Investment Trusts
PSA^E,Public Storage Depositary Shares Each Representing 1/1000 of a 4.90% Cumulative Preferred Share of Beneficial Interest Series E,$25.37,-0.11,-0.432%,,United States,,46478,Consumer Services,Real Estate Investment Trusts
PSA^F,Public Storage Depositary Shares Each Representing 1/1000 of a 5.15% Cumulative Preferred Share of Beneficial Interest Series F par value $0.01 per share,$25.69,-0.02,-0.078%,,United States,,29435,Consumer Services,Real Estate Investment Trusts
PSA^G,Public Storage Depositary Shares Each Representing 1/1000 of a 5.05% Cumulative Preferred Share of Beneficial Interest Series G,$25.53,-0.01,-0.039%,,United States,,32301,,
PSA^H,Public Storage Depositary Shares Each Representing 1/1000 of a  5.60% Cumulative Preferred  Share of Beneficial Interest Series H,$27.20,-0.20,-0.73%,,United States,,33798,,
PSA^I,Public Storage Depositary Shares Each Representing 1/1000 of a 4.875% Cumulative Preferred Share of Beneficial Interest Series I par value $0.01 per share,$26.17,-0.08,-0.305%,,United States,,53748,,
PSA^J,Public Storage Depositary Shares Each Representing 1/1000 of a 4.700% Cumulative Preferred Share of Beneficial Interest Series J par value $0.01 per share,$25.42,-0.20,-0.781%,,United States,,38084,,
PSA^K,Public Storage Depositary Shares Each Representing 1/1000 of a 4.75% Cumulative Preferred Share of Beneficial Interest Series K,$26.10,-0.23,-0.874%,,United States,,25619,Consumer Services,Real Estate Investment Trusts
PSA^L,Public Storage Depositary Shares Each Representing 1/1000 of a 4.625% Cumulative Preferred Share of Beneficial Interest Series L par value $0.01 per share,$25.17,-0.24,-0.945%,,United States,,144339,Consumer Services,Real Estate Investment Trusts
PSA^M,Public Storage Depositary Shares Each Representing 1/1000 of a 4.125% Cumulative Preferred Share of Beneficial Interest Series M,$24.89,-0.24,-0.955%,,United States,,32419,,
PSA^N,Public Storage Depositary Shares Each Representing 1/1000 of a 3.875% Cumulative Preferred Share of Beneficial Interest Series N,$24.36,-0.105,-0.429%,,United States,,59512,,
PSA^O,Public Storage Depositary Shares Each Representing 1/1000 of a 3.900% Cumulative Preferred Share of Beneficial Interest Series O,$24.83,-0.17,-0.68%,,United States,,41713,,
PSAC,Property Solutions Acquisition Corp. Common Stock,$15.00,-0.41,-2.661%,442747665.00,United States,2020,1881607,Capital Goods,Auto Manufacturing
PSACU,Property Solutions Acquisition Corp. Unit,$18.86,-0.79,-4.02%,0.00,United States,2020,12410,Capital Goods,Auto Manufacturing
PSACW,Property Solutions Acquisition Corp. Warrant,$3.93,-0.21,-5.072%,0.00,United States,2020,1039693,Capital Goods,Auto Manufacturing
PSB,PS Business Parks Inc. Common Stock,$146.22,-0.59,-0.402%,4019375342.00,United States,,72412,Consumer Services,Real Estate Investment Trusts
PSB^W,PS Business Parks Inc. Depositary Shares Each Representing 1/1000 of a Share of 5.20% Cumulative Preferred Stock Series W,$25.50,-0.04,-0.157%,,United States,,33760,,
PSB^X,PS Business Parks Inc. Depositary Shares Each Representing 1/1000 of a Share of 5.25% Cumulative Preferred Stock Series X,$25.72,-0.11,-0.426%,,United States,,14303,,
PSB^Y,PS Business Parks Inc. 5.20% Cumulative Preferred Stock Series Y,$25.49,-0.22,-0.856%,,United States,,30032,,
PSB^Z,PS Business Parks Inc. Depositary Shares Each Representing 1/1000 of a Share of 4.875% Cumulative Preferred Stock Series Z  par value $0.01 per share,$25.30,-0.17,-0.667%,,United States,,27343,,
PSCX,Pacer Swan SOS Conservative (December) ETF,$21.0806,0.0884,0.421%,,United States,2020,1,,
PSEC,Prospect Capital Corporation Common Stock,$7.28,-0.28,-3.704%,2807611461.00,United States,2004,3945017,,
PSF,Cohen & Steers Select Preferred and Income Fund Inc. Common Stock,$26.96,-0.17,-0.627%,323857998.00,,2010,34027,,
PSFD,Pacer Funds ETF,$21.1093,-0.3714,-1.729%,,United States,2020,200,,
PSFF,Pacer Swan SOS Fund of Funds ETF,$20.5846,-0.2716,-1.302%,,United States,2020,2403,,
PSHG,Performance Shipping Inc. Common Shares,$6.21,-0.35,-5.335%,31563728.00,Greece,,44100,Transportation,Marine Transportation
PSMD,Pacer Swan SOS Moderate (December) ETF,$20.9511,-0.2562,-1.208%,,United States,2020,1,,
PSMT,PriceSmart Inc. Common Stock,$97.51,-4.95,-4.831%,2997294948.00,United States,,147081,Consumer Services,Department/Specialty Retail Stores
PSN,Parsons Corporation Common Stock,$36.26,-0.51,-1.387%,3652365335.00,,2019,768098,Technology,EDP Services
PSNL,Personalis Inc. Common Stock,$31.68,-3.01,-8.677%,1233391262.00,United States,2019,947682,Health Care,Medical Specialities
PSO,Pearson Plc Common Stock,$10.57,-0.09,-0.844%,7966486589.00,United Kingdom,,347594,Consumer Services,Books
PSTG,Pure Storage Inc. Class A Common Stock,$23.72,-2.04,-7.919%,6471076659.00,,2015,9394791,Technology,Electronic Components
PSTH,Pershing Square Tontine Holdings Ltd. Class A Common Stock,$28.87,-0.49,-1.669%,5774002887.00,,2020,5197961,Finance,Business Services
PSTI,Pluristem Therapeutics Inc. Common Stock,$6.31,-0.43,-6.38%,198949675.00,Israel,,425103,Health Care,Biotechnology: Biological Products (No Diagnostic Substances)
PSTL,Postal Realty Trust Inc. Class A Common Stock,$16.33,0.19,1.177%,215785567.00,,2019,56321,Consumer Services,Real Estate Investment Trusts
PSTV,PLUS THERAPEUTICS Inc. Common Stock ,$3.00,-0.08,-2.597%,14338752.00,United States,,839939,Health Care,Medical/Dental Instruments
PSTX,Poseida Therapeutics Inc. Common Stock,$11.91,0.83,7.491%,736276319.00,United States,2020,529982,Health Care,Biotechnology: Biological Products (No Diagnostic Substances)
PSX,Phillips 66 Common Stock,$84.64,-2.61,-2.991%,36970767658.00,United States,,2766444,Energy,Integrated oil Companies
PSXP,Phillips 66 Partners LP Common Units representing limited partner interest in the Partnership,$27.24,-0.40,-1.447%,6219985577.00,United States,2013,1735485,Energy,Natural Gas Distribution
PT,Pintec Technology Holdings Limited American Depositary Shares,$1.55,-0.20,-11.429%,66864297.00,China,2018,420339,Technology,Computer Software: Programming Data Processing
PTA,Cohen & Steers Tax-Advantaged Preferred Securities and Income Fund Common Shares of Beneficial Interest,$24.95,0.03,0.12%,0.00,,2020,183945,,
PTC,PTC Inc. Common Stock,$134.48,-7.85,-5.515%,15708665013.00,United States,,620898,Technology,Computer Software: Prepackaged Software
PTCT,PTC Therapeutics Inc. Common Stock,$55.19,-2.44,-4.234%,3765930435.00,United States,2013,515506,Health Care,Major Pharmaceuticals
PTE,PolarityTE Inc. Common Stock,$1.33,-0.03,-2.206%,88847753.00,United States,,5282273,Health Care,Biotechnology: Biological Products (No Diagnostic Substances)
PTEN,Patterson-UTI Energy Inc. Common Stock,$7.50,0.035,0.469%,1408023158.00,United States,1993,2577621,Energy,Oil & Gas Production
PTGX,Protagonist Therapeutics Inc. Common Stock,$23.99,-1.32,-5.215%,1032018517.00,United States,2016,267492,Health Care,Major Pharmaceuticals
PTIC,PropTech Investment Corporation II Class A Common Stock,$10.35,-0.11,-1.052%,0.00,United States,2021,49947,Finance,Business Services
PTICU,PropTech Investment Corporation II Unit,$10.74,-0.19,-1.738%,0.00,United States,2020,28933,Finance,Business Services
PTICW,PropTech Investment Corporation II Warrant,$1.60,-0.15,-8.571%,0.00,United States,2021,72206,Finance,Business Services
PTK,PTK Acquisition Corp. Common Stock,$10.35,-0.15,-1.429%,148781250.00,United States,2020,62941,Finance,Business Services
PTMN,Portman Ridge Finance Corporation Common Stock,$2.07,0.02,0.976%,145239956.00,United States,,339702,,
PTN,Palatin Technologies Inc. Common Stock,$0.82,-0.0329,-3.857%,188628132.00,United States,,4079249,Health Care,Major Pharmaceuticals
PTNR,Partner Communications Company Ltd. American Depositary Shares,$4.91,-0.37,-7.008%,902071902.00,Israel,,15910,Public Utilities,Telecommunications Equipment
PTON,Peloton Interactive Inc. Class A Common Stock,$115.21,-7.51,-6.12%,33929536825.00,United States,2019,7598610,Energy,Consumer Electronics/Appliances
PTPI,Petros Pharmaceuticals Inc. Common Stock,$3.47,0.02,0.58%,33896081.00,United States,,45786,Health Care,Major Pharmaceuticals
PTR,PetroChina Company Limited Common Stock,$36.36,-0.55,-1.49%,66546427528.00,China,,182998,Energy,Oil & Gas Production
PTRS,Partners Bancorp Common Stock,$7.15,-0.02,-0.279%,127343023.00,United States,,16206,Finance,Major Banks
PTSI,P.A.M. Transportation Services Inc. Common Stock,$58.32,-0.73,-1.236%,334436740.00,United States,1986,6833,Transportation,Trucking Freight/Courier Services
PTVCA,Protective Insurance Corporation Class A Common Stock,$22.96,0.015,0.065%,327544306.00,United States,,2640,Finance,Property-Casualty Insurers
PTVCB,Protective Insurance Corporation Class B Common Stock,$22.93,-0.07,-0.304%,327116330.00,United States,,85483,Finance,Property-Casualty Insurers
PTVE,Pactiv Evergreen Inc. Common stock,$14.70,-1.60,-9.816%,2604218337.00,United States,2020,1251612,Consumer Durables,Containers/Packaging
PTY,Pimco Corporate & Income Opportunity Fund,$17.90,-0.11,-0.611%,1901001749.00,United States,2002,410618,,
PUBM,PubMatic Inc. Class A Common Stock,$65.43,5.16,8.561%,3129288157.00,United States,2020,1926395,Technology,Computer Software: Programming Data Processing
PUCKU,Goal Acquisitions Corp. Unit,$10.45,-0.05,-0.476%,0.00,United States,2021,364889,Finance,Business Services
PUK,Prudential Public Limited Company Common Stock,$40.24,-0.42,-1.033%,52503498699.00,United Kingdom,,1327736,Finance,Life Insurance
PUK^,Prudential Public Limited Company 6.75% Perpetual Subordinated Captial Security,$26.47,0.22,0.838%,,United Kingdom,,16186,,
PUK^A,Prudential Public Limited Company 6.50% Perpetual Subordinated Capital Securities Exchangeable at the Issuer's Option Into Non-Cumulative Dollar Denominated Preference Shares,$26.29,0.08,0.305%,,United Kingdom,,19394,,
PULM,Pulmatrix Inc. Common Stock,$1.63,-0.03,-1.807%,56084197.00,United States,2014,3408971,Health Care,Major Pharmaceuticals
PUMP,ProPetro Holding Corp. Common Stock,$11.20,-0.21,-1.84%,1130223102.00,United States,2017,1378747,Energy,Oilfield Services/Equipment
PUYI,Puyi Inc. American Depository Shares,$6.01,-0.0315,-0.521%,362491203.00,China,2019,6222,Finance,Investment Managers
PVAC,Penn Virginia Corporation Common Stock,$15.22,-0.52,-3.304%,575571620.00,United States,,515251,Energy,Oil & Gas Production
PVBC,Provident Bancorp Inc. (MD) Common Stock,$12.26,-0.23,-1.841%,233522889.00,United States,2015,53938,Finance,Savings Institutions
PVG,Pretium Resources Inc. Ordinary Shares (Canada),$10.76,0.15,1.414%,2014850275.00,Canada,,3415645,Basic Industries,Precious Metals
PVH,PVH Corp. Common Stock,$99.92,-2.37,-2.317%,7104336980.00,United States,,749093,Consumer Non-Durables,Apparel
PVL,Permianville Royalty Trust Trust Units ,$1.46,-0.07,-4.575%,48180000.00,United States,2011,255287,Energy,Oil & Gas Production
PW,Power REIT (MD) Common Stock,$38.61,-1.39,-3.475%,127394969.00,United States,,53932,Consumer Services,Real Estate Investment Trusts
PW^A,Power REIT 7.75% Series A Cumulative Perpetual Preferred Stock,$26.01,0.0516,0.199%,,United States,,210,,
PWFL,PowerFleet Inc. Common Stock,$7.89,-0.16,-1.988%,280247159.00,United States,,254609,Capital Goods,Telecommunications Equipment
PWOD,Penns Woods Bancorp Inc. Common Stock,$24.35,-0.44,-1.775%,171724747.00,United States,,10778,Finance,Major Banks
PWR,Quanta Services Inc. Common Stock,$84.61,3.48,4.289%,11749020749.00,United States,,2031916,Capital Goods,Engineering & Construction
PXD,Pioneer Natural Resources Company Common Stock,$149.05,-1.01,-0.673%,32225666168.00,United States,,2748908,Energy,Oil & Gas Production
PXLW,Pixelworks Inc.  Common Stock,$3.72,-0.21,-5.344%,189240875.00,United States,2000,664756,Technology,Semiconductors
PXS,Pyxis Tankers Inc. Common Stock,$1.45,-0.15,-9.375%,31261833.00,Greece,,706138,Transportation,Marine Transportation
PXSAP,Pyxis Tankers Inc. 7.75% Series A Cumulative Convertible Preferred Shares,$22.00,-1.95,-8.142%,0.00,Greece,,617,Transportation,Marine Transportation
PXSAW,Pyxis Tankers Inc. Warrant,$0.5698,0.0397,7.489%,0.00,Greece,,11969,Transportation,Marine Transportation
PYN,PIMCO New York Municipal Income Fund III Common Shares of Beneficial Interest,$9.20,0.0906,0.995%,52698437.00,United States,2002,5111,,
PYPD,PolyPid Ltd. Ordinary Shares,$10.85,-1.30,-10.70%,200667918.00,Israel,2020,91492,Health Care,Medical/Dental Instruments
PYPL,PayPal Holdings Inc. Common Stock,$253.94,-12.13,-4.559%,297408372494.00,United States,,13346639,Miscellaneous,Business Services
PYS,Merrill Lynch Depositor Inc PPlus Tr Ser RRD-1 Tr Ctf Cl A,$20.75,0.18,0.875%,0.00,United States,,4161,Finance,Finance: Consumer Services
PYT,PPlus Tr GSC-2 Tr Ctf Fltg Rate,$24.037,-0.363,-1.488%,0.00,United States,,1019,Finance,Finance: Consumer Services
PZC,PIMCO California Municipal Income Fund III Common Shares of Beneficial Interest,$10.09,-0.24,-2.323%,225750996.00,United States,2002,154552,,
PZG,Paramount Gold Nevada Corp. Common Stock,$1.12,-0.06,-5.085%,40573732.00,United States,2015,165829,Basic Industries,Precious Metals
PZN,Pzena Investment Management Inc Class A Common Stock,$9.36,-0.15,-1.577%,666150891.00,United States,2007,97859,Finance,Investment Managers
PZZA,Papa John's International Inc. Common Stock,$90.75,-11.89,-11.584%,2990410698.00,United States,1993,2685541,Consumer Services,Restaurants
QADA,QAD Inc. Class A Common Stock,$63.71,-2.98,-4.468%,1318738196.00,United States,,32274,Technology,Computer Software: Prepackaged Software
QADB,QAD Inc. Class B Common Stock,$46.0038,0.00,0.00%,952236198.00,United States,,844,Technology,Computer Software: Prepackaged Software
QCOM,QUALCOMM Incorporated Common Stock,$135.53,-5.57,-3.948%,153962080000.00,United States,1991,12669795,Technology,Radio And Television Broadcasting And Communications Equipment
QCON,American Century ETF Trust American Century Quality Convertible Securities ETF,$47.2439,-1.5932,-3.262%,,,2021,522,,
QCRH,QCR Holdings Inc. Common Stock,$42.48,-1.12,-2.569%,670901805.00,United States,,39011,Finance,Major Banks
QD,Qudian Inc. American Depositary Shares each representing one Class A Ordinary Share,$2.27,-0.19,-7.724%,575965622.00,China,2017,7921499,Finance,Finance: Consumer Services
QDEC,FT Cboe Vest Growth-100 Buffer ETF - December,$19.96,-0.3477,-1.712%,,United States,2020,104485,,
QDEL,Quidel Corporation Common Stock,$166.15,-5.98,-3.474%,7031320957.00,United States,,838037,Health Care,Biotechnology: In Vitro & In Vivo Diagnostic Substances
QELL,Qell Acquisition Corp. Class A Ordinary Shares,$11.60,-0.39,-3.253%,550275000.00,United States,2020,2165304,Finance,Business Services
QELLU,Qell Acquisition Corp. Unit,$12.45,-0.42,-3.263%,0.00,United States,2020,27100,Finance,Business Services
QELLW,Qell Acquisition Corp. Warrant,$2.77,-0.29,-9.477%,0.00,United States,2020,445353,Finance,Business Services
QEP,QEP Resources Inc. Common Stock,$3.46,-0.22,-5.978%,839277741.00,United States,,4558364,Energy,Oil & Gas Production
QFIN,360 DigiTech Inc. American Depositary Shares,$23.84,-1.85,-7.201%,3626339304.00,China,2018,2718478,Finance,Finance: Consumer Services
QGEN,Qiagen N.V. Common Shares ,$50.34,-1.08,-2.10%,11476764900.00,Netherlands,,813164,Health Care,Biotechnology: Biological Products (No Diagnostic Substances)
QH,Quhuo Limited American Depository Shares,$7.01,-0.80,-10.243%,363863934.00,China,2020,140067,Miscellaneous,Business Services
QIWI,QIWI plc American Depositary Shares,$10.73,-0.24,-2.188%,672910222.00,Cyprus,2013,376433,Miscellaneous,Business Services
QK,Q&K International Group Limited American Depositary Shares,$2.77,-0.19,-6.419%,150165387.00,China,2019,50548,Finance,Real Estate
QLGN,Qualigen Therapeutics Inc. Common Stock,$3.40,-0.22,-6.077%,90803967.00,United States,2015,1059673,Health Care,Major Pharmaceuticals
QLI,Qilian International Holding Group Ltd. Ordinary Shares,$5.87,-0.15,-2.492%,209852500.00,China,2021,206802,Health Care,Major Pharmaceuticals
QLYS,Qualys Inc. Common Stock,$97.23,-4.01,-3.961%,3812168074.00,United States,2012,519347,Technology,Computer Software: Prepackaged Software
QMCO,Quantum Corporation Common Stock,$8.10,-0.38,-4.481%,458971977.00,United States,,417960,Technology,Electronic Components
QNST,QuinStreet Inc. Common Stock,$23.26,-0.64,-2.678%,1239676613.00,United States,2010,194744,Miscellaneous,Business Services
QPFF,American Century ETF Trust American Century Quality Preferred ETF,$39.3559,-0.3097,-0.781%,,,2021,3302,,
QQQX,Nuveen NASDAQ 100 Dynamic Overwrite Fund Shares of Beneficial Interest,$26.20,-0.67,-2.493%,1073064885.00,United States,,162184,,
QRHC,Quest Resource Holding Corporation Common Stock,$2.93,-0.15,-4.87%,53856995.00,United States,,71437,Technology,Diversified Commercial Services
QRTEA,Qurate Retail Inc. Series A Common Stock ,$12.10,-0.49,-3.892%,5048380017.00,United States,,4110234,Consumer Services,Catalog/Specialty Distribution
QRTEB,Qurate Retail Inc. Series B Common Stock ,$12.12,-0.45,-3.58%,5056724447.00,United States,,2642,Consumer Services,Catalog/Specialty Distribution
QRTEP,Qurate Retail Inc. 8.0% Fixed Rate Cumulative Redeemable Preferred Stock,$100.05,0.05,0.05%,0.00,United States,,115696,Consumer Services,Catalog/Specialty Distribution
QRVO,Qorvo Inc. Common Stock,$168.95,-10.20,-5.694%,19135734348.00,United States,,1740850,Technology,Semiconductors
QS,QuantumScape Corporation Class A Common Stock,$57.58,-2.03,-3.405%,20958757534.00,United States,2020,17214113,Miscellaneous,Industrial Machinery/Components
QSR,Restaurant Brands International Inc. Common Shares,$61.48,-0.54,-0.871%,18635403163.00,Canada,2014,1800947,Consumer Services,Restaurants
QTNT,Quotient Limited Ordinary Shares,$4.53,-0.11,-2.371%,458133636.00,Switzerland,2014,1834624,Health Care,Biotechnology: In Vitro & In Vivo Diagnostic Substances
QTRX,Quanterix Corporation Common Stock,$73.77,-4.39,-5.617%,2348566728.00,United States,2017,392327,Capital Goods,Biotechnology: Laboratory Analytical Instruments
QTS,QTS Realty Trust Inc. Class A Common Stock,$62.33,0.55,0.89%,4025278755.00,United States,2013,1016752,Consumer Services,Real Estate Investment Trusts
QTS^A,QTS Realty Trust Inc. 7.125% Series A Cumulative Redeemable Perpetual Preferred Stock,$26.14,-0.43,-1.618%,,United States,,10779,,
QTS^B,QTS Realty Trust Inc. 6.50% Series B Cumulative Convertible Perpetual Preferred Stock,$140.78,0.822,0.587%,,United States,,4055,,
QTT,Qutoutiao Inc. American Depositary Shares,$3.49,-0.32,-8.399%,931222921.00,China,2018,8385286,Technology,Computer Software: Programming Data Processing
QTWO,Q2 Holdings Inc. Common Stock,$122.31,-8.35,-6.391%,6590450400.00,,2014,730000,Technology,Computer Software: Prepackaged Software
QUAD,Quad Graphics Inc Class A Common Stock,$4.55,-0.59,-11.479%,244137121.00,United States,,310240,Miscellaneous,Publishing
QUIK,QuickLogic Corporation Common Stock,$7.42,0.58,8.48%,82128114.00,United States,1999,320653,Technology,Semiconductors
QUMU,Qumu Corporation Common Stock,$8.99,-0.03,-0.333%,157685310.00,United States,,89257,Technology,Computer Software: Prepackaged Software
QUOT,Quotient Technology Inc. Common Stock,$13.40,-0.25,-1.832%,1219474477.00,,2014,579539,Consumer Services,Advertising
QURE,uniQure N.V. Ordinary Shares,$37.00,-0.47,-1.254%,1646357217.00,Netherlands,2014,448254,Health Care,Major Pharmaceuticals
QVCC,QVC Inc. 6.250% Senior Secured Notes due 2068,$25.00,-0.18,-0.715%,0.00,United States,2019,61325,Consumer Services,Catalog/Specialty Distribution
QVCD,QVC Inc. 6.375% Senior Secured Notes due 2067,$25.205,0.015,0.06%,0.00,United States,2018,15998,Consumer Services,Catalog/Specialty Distribution
R,Ryder System Inc. Common Stock,$68.26,-0.97,-1.401%,3678471536.00,United States,,450683,Consumer Services,Rental/Leasing Companies
RA,Brookfield Real Assets Income Fund Inc. Common Stock,$20.06,-0.27,-1.328%,880439679.00,,2016,682012,,
RAAC,Revolution Acceleration Acquisition Corp Class A Common Stock,$11.98,-0.97,-7.49%,459233329.00,United States,2021,6079514,Finance,Business Services
RAACU,Revolution Acceleration Acquisition Corp Unit,$12.74,-1.10,-7.948%,0.00,United States,2020,873991,Finance,Business Services
RAACW,Revolution Acceleration Acquisition Corp Warrant,$2.65,-0.44,-14.239%,0.00,United States,2021,857316,Finance,Business Services
RAAS,Cloopen Group Holding Limited American Depositary Shares each representing two Class A Ordinary Shares,$21.03,-5.21,-19.855%,3361546680.00,,2021,2916374,Technology,Computer Software: Prepackaged Software
RACA,Therapeutics Acquisition Corp. Class A Common Stock,$14.48,-0.586,-3.89%,252442872.00,United States,2020,28186,Finance,Business Services
RACE,Ferrari N.V. Common Shares,$194.83,-1.58,-0.804%,48336312222.00,,2015,295263,Capital Goods,Auto Manufacturing
RAD,Rite Aid Corporation Common Stock,$20.94,-1.02,-4.645%,1156398161.00,United States,,1857740,Health Care,Medical/Nursing Services
RADA,RADA Electronic Industries Ltd. Ordinary Shares,$13.01,-1.05,-7.468%,565740696.00,Israel,,565994,Technology,Electronic Components
RADI,Radius Global Infrastructure Inc. Class A Common Stock,$12.25,-0.36,-2.855%,746017907.00,United States,,134922,Consumer Services,Real Estate
RAIL,FreightCar America Inc. Common Stock,$3.39,-0.38,-10.08%,52663070.00,United States,2005,162970,Capital Goods,Railroads
RAMP,LiveRamp Holdings Inc. Common Stock,$62.83,-4.05,-6.056%,4204546593.00,United States,2018,724153,Technology,EDP Services
RAND,Rand Capital Corporation Common Stock,$15.91,0.11,0.696%,41107813.00,United States,,4434,Finance,Finance: Consumer Services
RAPT,RAPT Therapeutics Inc. Common Stock,$18.85,-1.00,-5.038%,462866632.00,United States,2019,123039,Health Care,Major Pharmaceuticals
RARE,Ultragenyx Pharmaceutical Inc. Common Stock,$136.25,-6.48,-4.54%,9121834495.00,United States,2014,314017,Health Care,Major Pharmaceuticals
RAVE,Rave Restaurant Group Inc. Common Stock,$1.23,-0.11,-8.209%,22146032.00,United States,,634020,Consumer Non-Durables,Food Distributors
RAVN,Raven Industries Inc. Common Stock,$39.72,-1.87,-4.496%,1424112340.00,United States,,253304,Capital Goods,Specialty Chemicals
RBA,Ritchie Bros. Auctioneers Incorporated Common Stock,$54.83,0.48,0.883%,6015526615.00,Canada,,846619,Miscellaneous,Business Services
RBAC,RedBall Acquisition Corp. Class A Ordinary Shares,$10.42,-0.28,-2.617%,748937500.00,United States,2020,530192,Finance,Business Services
RBB,RBB Bancorp Common Stock,$19.22,-0.71,-3.562%,376057002.00,United States,2017,37003,Finance,Major Banks
RBBN,Ribbon Communications Inc. Common Stock,$9.115,-0.305,-3.238%,1325290292.00,United States,,600389,Technology,EDP Services
RBC,Regal Beloit Corporation Common Stock,$136.21,-2.32,-1.675%,5529483361.00,United States,,195669,Consumer Durables,Metal Fabrications
RBCAA,Republic Bancorp Inc. Class A Common Stock,$42.68,-0.82,-1.885%,892484638.00,United States,1998,71769,Finance,Major Banks
RBCN,Rubicon Technology Inc. Common Stock,$10.55,0.3999,3.94%,25550222.00,United States,2007,2835,Technology,Semiconductors
